{
  "id": "intent_986868e2cf76",
  "type": "execution_intent",
  "title": "请为 IntentBuilder 类添加完整的文档注释，包括：",
  "version": "1.0.0",
  "status": "draft",
  "created_at": "2026-01-25T11:33:24.012473+00:00",
  "lineage": {
    "introduced_in": "0.9.4",
    "derived_from": [],
    "supersedes": []
  },
  "scope": {
    "project_id": "agentos",
    "repo_root": ".",
    "targets": {
      "files": [],
      "modules": [],
      "areas": [
        "docs",
        "frontend"
      ]
    }
  },
  "objective": {
    "goal": "请为 IntentBuilder 类添加完整的文档注释，包括：",
    "success_criteria": [
      "Task completed successfully"
    ],
    "non_goals": []
  },
  "selected_workflows": [
    {
      "workflow_id": "documentation",
      "phases": [
        "analysis",
        "implementation",
        "review"
      ]
    }
  ],
  "selected_agents": [
    {
      "agent_id": "technical_writer",
      "role": "documentation",
      "responsibilities": [
        "Write and update documentation"
      ]
    }
  ],
  "planned_commands": [],
  "interaction": {
    "mode": "semi_auto",
    "question_budget": 10,
    "question_policy": "blockers_only"
  },
  "risk": {
    "overall": "medium",
    "drivers": [
      "Risk level: medium",
      "missing_actions: No clear actions detected in the input"
    ],
    "requires_review": []
  },
  "budgets": {
    "max_files": 50,
    "max_commits": 10,
    "max_tokens": 500000,
    "max_cost_usd": 50.0
  },
  "evidence_refs": [
    "nl_request:nl_req_001",
    "nl_input:0:134",
    "risk_assessment:medium"
  ],
  "constraints": {
    "execution": "forbidden",
    "no_fabrication": true,
    "registry_only": true,
    "lock_scope": {
      "mode": "files",
      "paths": []
    }
  },
  "audit": {
    "created_by": "intent_builder_v0.9.4",
    "source": "agentos",
    "checksum": "be96853aa725214cd01150c5a6499d4a79f1968d79eab293d9e890349c7f9edd"
  }
}