{
  "id": "intent_090378008b53",
  "type": "execution_intent",
  "title": "添加 Builder 输出持久化到数据库：",
  "version": "1.0.0",
  "status": "draft",
  "created_at": "2026-01-25T11:27:52.387616+00:00",
  "lineage": {
    "introduced_in": "0.9.4",
    "derived_from": [],
    "supersedes": []
  },
  "scope": {
    "project_id": "agentos",
    "repo_root": ".",
    "targets": {
      "files": [],
      "modules": [],
      "areas": [
        "frontend"
      ]
    }
  },
  "objective": {
    "goal": "添加 Builder 输出持久化到数据库：",
    "success_criteria": [
      "Complete: 添加 Builder 输出持久化到数据库：",
      "Complete: 新增 builder_outputs 表（id, nl_request_id, output_json, created_at）",
      "Complete: 新增 builder_selections 表（output_id, type, content_id, evidence）",
      "Complete: 更新 Builder 类以保存输出到数据库"
    ],
    "non_goals": []
  },
  "selected_workflows": [
    {
      "workflow_id": "documentation",
      "phases": [
        "analysis",
        "implementation",
        "review"
      ]
    }
  ],
  "selected_agents": [
    {
      "agent_id": "technical_writer",
      "role": "documentation",
      "responsibilities": [
        "Write and update documentation"
      ]
    }
  ],
  "planned_commands": [],
  "interaction": {
    "mode": "semi_auto",
    "question_budget": 10,
    "question_policy": "blockers_only"
  },
  "risk": {
    "overall": "medium",
    "drivers": [
      "Risk level: medium"
    ],
    "requires_review": []
  },
  "budgets": {
    "max_files": 50,
    "max_commits": 10,
    "max_tokens": 500000,
    "max_cost_usd": 50.0
  },
  "evidence_refs": [
    "nl_request:nl_req_003",
    "nl_input:0:253",
    "risk_assessment:medium"
  ],
  "constraints": {
    "execution": "forbidden",
    "no_fabrication": true,
    "registry_only": true,
    "lock_scope": {
      "mode": "files",
      "paths": []
    }
  },
  "audit": {
    "created_by": "intent_builder_v0.9.4",
    "source": "agentos",
    "checksum": "2057b2f869c922c1c7639000c13fe5e7598f3eafa0eff9f303d8cb0538ad85c0"
  }
}